{
  "rule_id": "R6",
  "name": "低转化率复查提醒",
  "evaluation_grain": { "time": "14day", "entity": "campaign" },
  "attribution_model": null,
  "trigger_condition": {
    "all": [
      { "concept": "cvr", "op": "<", "ref": "baseline*0.5", "window_days": 14 }
    ]
  },
  "diagnosis": "该campaign转化率显著低于账户基准，建议复查落地页与商品详情页",
  "match_inputs": [
    { "concept": "cvr", "role": "trigger_signal", "required": true }
  ],
  "reference_action": {
    "type": "review_landing_page",
    "param": {}
  },
  "confidence_model": { "source": ["human_expert", "historical_pattern"], "thresholds": { "high": 0.7, "minimum_usable": 0.5 } },
  "review_policy": { "mode": "review_only", "supported_plan_actions": [], "conflicting_plan_actions": ["increase_budget"], "otherwise": "NOT_APPLICABLE" },
  "confidence": 0.5,
  "risk_level": "LOW",
  "evidence_type": "human_expert",
  "validation_count": 0,
  "rejection_count": 0,
  "version_history": [
    {
      "version": "1.0",
      "date": "2026-07-07",
      "author": "human_expert",
      "change": "初始版本，用于演示反馈进化机制。"
    },
    {
      "version": "1.1-review-only",
      "date": "2026-08-03",
      "author": "ontology_team",
      "change": "将反馈计数移出静态规则卡，改由独立 confidence_state 管理；增加 review-only 动作映射。"
    },
    { "version": "1.2-contract-hardening", "date": "2026-08-03", "author": "ontology_team", "change": "将参考动作重命名为不可执行的reference_action；触发条件由运行时真实求值。" }
  ],
  "causal_annotation": "相关性证据，证据强度弱，尚未经过验证",
  "status": "ACTIVE",
  "known_limitations": [
    "规则置信度等于最低可用阈值，评价界面必须标注低置信；反馈累计由独立 confidence_state 管理。"
  ]
}
