{
  "rule_id": "R1",
  "name": "高ACoS低CTR渠道创意不匹配",
  "evaluation_grain": { "time": "14day", "entity": "campaign" },
  "attribution_model": null,
  "trigger_condition": {
    "all": [
      { "concept": "acos", "op": ">", "ref": "baseline*1.3", "window_days": 14 },
      { "concept": "ctr", "op": "<", "ref": "baseline*0.6", "window_days": 14 }
    ]
  },
  "diagnosis": "该campaign的ACoS显著高于账户基准且CTR显著低于基准，提示渠道/创意与目标受众不匹配",
  "match_inputs": [
    { "concept": "acos", "role": "trigger_signal", "required": true },
    { "concept": "ctr", "role": "comparison_signal", "required": true }
  ],
  "reference_action": {
    "type": "review_creative_and_targeting",
    "param": { "priority": 1 }
  },
  "confidence_model": { "source": ["historical_pattern", "data_quality"], "thresholds": { "high": 0.7, "minimum_usable": 0.5 } },
  "review_policy": { "mode": "review_only", "supported_plan_actions": [], "conflicting_plan_actions": ["increase_budget"], "otherwise": "NOT_APPLICABLE" },
  "confidence": 0.65,
  "risk_level": "MEDIUM",
  "evidence_type": "historical_pattern",
  "validation_count": 0,
  "rejection_count": 0,
  "version_history": [
    {
      "version": "1.0",
      "date": "2026-07-17",
      "author": "human_expert",
      "change": "初始版本，沿用 R-042 触发逻辑，基准由行业CTR均值改为账户内生基准，评估窗口由7天订正为14天"
    },
    {
      "version": "1.1-review-only",
      "date": "2026-08-03",
      "author": "ontology_team",
      "change": "增加 review-only 输入、置信度分层和方案动作映射；规则不再承担方案生成或执行。"
    },
    { "version": "1.2-contract-hardening", "date": "2026-08-03", "author": "ontology_team", "change": "将参考动作重命名为不可执行的reference_action；触发条件由运行时真实求值。" }
  ],
  "causal_annotation": "相关性证据，非因果证明"
,
  "status": "ACTIVE",
  "known_limitations": ["账户内生基准及倍数均需在生产数据上重新标定。"]
}
